14219544,831,1950,אמא שלי היא אישה מאוד חמה ואוהבת  היא מרבה לעזור בכל הזדמנות למשפחה  לחברים וגם לאנשים שאינה מכירה  היא יודעת להוות אוזן קשבת לאנשים ולתמוך בהם כשהם צריכים  היא אחראית מאוד בכל אשר היא עושה ויש לה ביטחון עצמי גבוה  בעיניי היא אדם חיובי מאוד שכל אחד יכו
14220547,832,1953,יצחק רבין  לדעתי בחרתי ברבין כי הוא שאף להגיע לשלום תמיד ניסה לגשר  בן אדם כריזמטי שתרם למדינה כולה 
14220647,833,1954,יוני נתניהו  בנאדם שלא הפסיק לתת  לא הרגיש שייך לשום מקום חוץ מלארץ למרות שהיו לא אופציות ללימודים גבוהים בחול  הרגיש צורך להתגייס שוב ושוב לצבא כדי להילחם ולא לשבת מהצד ולקוות לטוב  יוני היה מצטיין בכל מקום שאליו הגיע  בית ספר  ספורט  צבא  בנוסף  יונ
14220789,834,1956,בחרתי דמות מציאותית  את אמא שלי  תכונות האופי החיוביות שלה הן הרגישות שהיא מביעה לסובבים אתה והאכפתיות הרבה מהם  היא אישה שעומדת על שלה כשצריך ולא מוותרת על דברים שהיא רוצה להשיג  היא שאפתנית  פרפקציונסטית  ושמה דגש עד הפרטים הקטנים  יש לה יכולת להוביל אנ
14221120,835,1957,הדמות שבחרתי היא רבין  הייתה לו היכולת לשלב בין חיי קריירה לחיי משפחה  הוא עמד מאחורי העקרונות שלו  היה לו מבט רחב על העולם ועל הדרך שבה הוא רצה שיראה  רבין היה אדם אקטיבי   מדבר וגם עושה  רבין הכיר גם במגרעותיו 
14221490,836,1960,דמות שאני מתחברת אליה מאוד הינה שרה אהרונסון  אישה חזקה  מנהיגה חסרת פחד שאוהבת את הארץ מאוד ומוכנה להילחם למען האמונות שלה  מודל לחיקוי והערצה 
14221634,837,1962,אני בוחרת בדמות מציאותית שכבר אינה בחיים יותר סבא שלי משה הוד  סבא שלי הינו ניצול שואה עלה לארץ והשתתף במלחמת העצמאות  המשך חייו עבד בחברת צים  סבא שלי הוא בן אדם עקשן בדרך שקטה  עצמאי  מחושב  תמיד ממשיך קדימה עם כמה שקשה  בחרתי בו כדמות מפני שהוא כבן
14221655,838,1964,שמעון פרס  בחרתי בו כיוון שאני מעריכה בו מאוד את הצניעות והדבקות במטרה  למרות שנכשל פעמים רבות  לא נכנע והמשיך לפעול למען מטרתו  כל זה  תוך צניעות וענווה הראויות להערכה 
14221660,839,1965,אני בוחרת בפו הדוב  אני חושבת שלפו הדוב יש גישה מאוד חיובית לחיים  הוא רואה את הטוב שבסובבים אותו ולא מנסה למצוא רע   בנוסף הוא נקלע לסיטואציות רבות  גם פחות שמחות אך תמיד יודע לקחת אותם ברוח טובה ובפשטות  הוא גורם גם לי לחייך 
14222973,840,1970,הדמות שבחרתי היא אמא שלי  אמא שלי תמיד יודעת לחזק ולדאוג  לתת מעצמה יותר ממה שהיא יכולה  לדבר ולהתייחס לכל בן אדם בכבוד בלי קשר ליחסים שלך ולמידת ההיכרות שלך איתו 
14223225,841,1971,דמות היסטורית בעלת תכונות אופי חיוביות בעיניי הוא צרציל  שהנהיג את בריטניה בשעתה הקשה ביותר בזמן מלחמת העולם השנייה  ועשה זאת באחריות רבה  במנהיגות מעוררת הערצה ובעזרת רתימת כל העם סביב החזון והנחישות שלו 
14223908,842,1977,דמות עם תכונות אופי שנראות לי חיוביות היא אבא שלי  התכונה הכי חזקה שלו זה חוזק נפשי אני חושבת שזה מה שבן אדן צריך הרבה  להיות חזק לא לוותר גם אם המשימה ממש קשה  להמשיך ולסיים אותה על הצד הטוב ביותר  ותמיד לשאוף הכי גבוה 
14224118,843,1978,אישה חזקה  מתגברת על קשיים  נאמנה  אוהבת לתת ולעזור  דואגת  אכפתית  אישה זו היא סבתא שלי  חנה איזנשטיין  בחרתי בה משום ששלשום הייתה אזכרה לסבי  סבי נפטר לפני 11 שנים ממחלת הסרטן  סבתי הייתה אז בת 56 בלבד  ועד היום היא לא מוכנה לחשוב על להכניס ללב אדם א
14224183,844,1980,בחרתי בפו הדוב  הוא חברותי דומיננטי נהנה מהחיים  דבוק במטרה שלו  אחראי  עוזר לכולם  בחרתי בו מכיוון שהוא מאוד דומה לי  ואני חושבת שהתכונות האלו מאוד חיוביות לכל בן אדם  צריך לדעת לאיזה אנשים להתחבר ולהראות את עצמך 
14224327,845,1981,ספיידרמן  הוא דמות לחיקוי מבחינתי  כיוון שטובת האנשים שמסביבו חשובה לו מטובתו שלו  הוא רוצה להגן עליהם ולשמור עליהם ועם זאת יש לו כח רב  המשפט עם כח גדול באה אחריות גדולה  מלווה אותי במשך החיים ומעצב את ההתנהגות שלי 
14224353,846,1982,מהטמה גנדי היה מנהיג רוחני הוגה דעות שהרבה מהדברים שאמר השפיעו עליי כאשר למדתי עליו  דבר שמאוד מלווה אותי בחיים הוא המשפט שלו היה השינוי שאתה רוצה להיות בעולם  המשפט הזה מתאים כמעט לכל תחום אני באמת מאמינה שאם כל אחד ייעשה את השינוי הקטן שהוא רוצה ולא י
14224503,847,1984,אמא שלי  הבן אדם הכי אופטימי שאני מכירה וממנה הושפעתי להיות כזו חיובית  גם אם משו רע יקרה היא תמיד תהיה רגוע ותתן לי את התחשובה שהכל בסדר  היא תמיד אכפתית ודואגת  תמיד תנחם ותצליח להוציא את הטוב גם מהדבר שבאותו רגע נראלך הכי לא טוב שיכול לקרוץ  תמיד תד
14224687,848,1987,יצחק רבין  הלך עם האמת שלו ודעתו עד הסוף  ופעל המון על מנת לממשה  התמדה ורצינות אלו תכונות שאני מאוד מעריך 
14224951,849,1989,בחרתי באמא שלי מכיוון שהיא אדם שאני מאוד מעריך ולמדתי ממנה המון  היא תמיד מצליחה להסתדר למרות כל הקשיים ולתת לי ולאחים שלי כל מה שאנחנו צריכים למרות שהיא הייתה במצבים לא פשוטים  היא יודעת תמיד לראות את הטוב באנשים  לעזור ולסלוח אם צריך ויש לה טוב לב נדיר 
14225230,850,1993,דמות מנהיגותית  ערכית  אינטיליגנטית מובילה בחברה ומנצלת את כוחה לטובה  אכפתית ורגישה לזולת  שיש לה מטרה והיא עובדת קשה על מנת להשיג אותה  יצחק רבין ומנחם בגין היו דמויות כאלה  הם היו מנהיגים  מובילים  הוגי דעות  הם היו רגישים לרצונות העם  והיו להם מטרות 
14225230,851,1993,דמות מנהיגותית  ערכית  אינטיליגנטית מובילה בחברה ומנצלת את כוחה לטובה  אכפתית ורגישה לזולת  שיש לה מטרה והיא עובדת קשה על מנת להשיג אותה  יצחק רבין ומנחם בגין היו דמויות כאלה  הם היו מנהיגים  מובילים  הוגי דעות  הם היו רגישים לרצונות העם  והיו להם מטרות 
14225928,852,1996,מולאן  זה נשמע קלישאתי ומעט ילדותי לכתוב על מולאן  ובכל זאת אני בוחרת בה מכיוון שהתכונות החיוביות שלה הן מוקצנות ומשמעותיות  מולאן יצאה למלחמה במקום אביה הפצוע על אף שאסור נשים בצבא בסין בתקופה ההיא  בעייני היא מודל לאומץ  והקרבה  היא לקחה אחריות ויוזמ
14226920,853,1999,אופרה ווינפרי  אשת הציבור העולמית  אופרה באה ממשפחה במעמד נמוך יחסית  וכשהייתה צעירה עברה התעללות מינית  היא החליטה שהיא נרתמת לעזרת החלש  ומאז הקימה בתי ספר באפריקה  עזרה לנשים במצוקה   וזוהי בעצם מטרתה העיקרית   אני רואה בה אישה חזקה  שלא מפחדת ללכת
14227117,854,2001,אני מעריצה של סבתא שלי  היא אישה מלאת עוצמה ואהבה  היא חרוצה ואכפתית  לא אכפת לה מה אנשים חושבים עליה  היא הולכת בדרך שלה ובאמונה שלה  היא טובת לב ושמה לב לפרטים קטנים  תמיד משתדלת לעזור ולעשות הכל בחיוך 
14227211,855,2002,פוקהונטס  נערה בעלת אופי חזק  דומיננטית בחברתה  עקשנית עד שתקבל את מבוקשתה  חוקרת את עולמה  מגלה בו דברים חדשים ומלמדת את האחרים  סבלנית וסובלנית  מקשיבה ולומדת מתרבות אחרת  עם אחר את דעותיו ומנהגיו  חברותית  חברה של כל הסובבים אותה ודואגת לכולם  אכפתי
14227304,856,2003,נפתלי בנט  לדעתי הסמל לישראלי החדש של המאה ה 21  יוצא יחידה מובחרת בצהל  איש הייטק שעשה אקזיט  ואיש חכם שאוהב את הארץ ותושביה 
14227307,857,2004,אישה חזקה אשר עומדת על שלה ומאמינה בעצמה  שאין לה הצורך לרדת ולפגוע באחר ובחלש על מנת להרגיש ששווה משהו  אישה סבלנית  אשר יודעת לאהוב  בעלת משמעת עצמית ושאיפה למצויינו  אשר גם גמישה ורגישה לאנשים שחיים איתה יחד  זוהי אמא שלי אשר אני מאוד מעריכה את אופי של
14228452,858,2008,הדמות שבחרתי לכתוב עליה הינה שרה אהרונסון  שרה מייצגת את הדמות הנשית היהודייה הלוחמת שפעלה טרם מלחמת העולם הראשונה על מנת לפעול לחירות ישראל  שרה הינה דמות חזקה  עקשנית ושאפתנית שלא נכנעה לנורמות החברה ולקחה חלק פעיל במלחמה על עצמאות ישראל בארצו הלויאליות
14228613,859,2009,סבא שלי מצד אמא הוא הגורם העיקרי שחינך אותי וממנו ירשתי את רוב האני הפנימי שלי היה תמיד סבלני אהב לפנק אותי תמיד הגיע לפני הזמן וחיכה לי כל פעם היה מחייך אלי עזר לאחרים  היה קשוב תמיד
14228826,860,2010,בנימין זאב הרצל   חוזה המדינה  אם תרצו אין זו הגדה אמר  על הקמת מדינה יהודית בארץ לשראל  דבר שלפניו באמת היה נראה תלוש מהמציאות  הרי היהודים היו פזורים בכל רחבי תבל  לכל אחד היה את הרכוש שלו  וחי על בסיס התרבות בארץ בה הוא חי והם ראו בעלייה לארץ ישרא
14230512,861,2015,דמות שנתפסת לי כחיוביות זה אבא שלי  אבא שלי לפני 10 שנים קפץ על מחבל תוך שהוא מסכן את חייו בשביל אנשים אחרים  אנשים כאלה כמו אבא שלי נתפסים בעיני כאנשים בעלי אופי חיובי שמוכנים לחרף את נפשם לטובת אנשים שהם בכלל לא מכירים או לא פגשו מעולם  התכונות החיוביות
14231009,862,2018,אילן רמון  בעקבות השתתפותו בהפצצת הכור בעיראק  שהסכים להיות במטוס השמיני שנחת כדי להפציץ כי היה הכי צעיר ולו אין משפחה וילדים  טיסתו לחלל  בעקבות הסיפורים ששמעתי  היותו צנועה  חזק אופי  מוכן להקריב בשביל המדינה  בחרתי בו
14231133,863,2020,מרטין לותר קינג  לדעתי מדובר באדם ששינה מסוכמות חברתיות בצורה של מאבק פנימי  הוא היה מנהיג שסחף אחריו רבים  עמד על שלו למרות כל הניסיונות לבטל אותו  היה ערכי ונאמן לאנשיו  הוא הותיר חותם בעולם ולדעתי זה משהו שכולנו שואפים לעשות 
14231375,864,2021,אמא שלי היא דמות שיש בה הרבה תכונות אופי חיוביות בעיניי  היא יודעת לקבל את הסביבה שלה  לעמוד על שלה כשצריך  היא מאוד סלחנית  היא אוהבת  היא קשובה  היא רצינית  והיא יודעת לאזן את עצמה  בעיניי תכונות אלה הן תכונות שאני הייתי רוצה שיהיו לי במידה שיש אותן לאי
14231517,865,2022,דמות שנראית לי בעלת התכונות החיוביות ביותר הינו הרצל חוזה המידה  התגלמות החיוביות שכן הוא הפך את חזונו שהיה נשמע לרבים חסר סיכוי למציאות  לאחר קשיים רבים ועליות ומורדות הוא הצליח להשיג הכרה במדינה ליהודים  הוא היה נחוש  כריזמטי ומוכשר  אם הרצל לא היה אדם
14231652,866,2023,לפי דעתי הרמיוני גריינגר מספרי הארי פוטר היא דמות בעלת תכונות אופי חיוביות; היא שאפתנית  בעלת מוטיבציה להצליח בכול תחום בו היא עוסקת  נאמנה לחבריה  גם כשקשה לה היא לא מוותרת  בחרתי בה כדמות בעלת תכונות אופי חיוביות כי אני מאוד רוצה להיות דומה לה מבחינת
14231991,867,2024,הרצל   חוזה המדינה  אדם שהעלה רעיון שבתחילה היה נשמע דמיוני לחלוטין ולמרות כל הקשיים ולמרות ההתנגדות הרבה והכשלונות בדרך  לא נכנע  המשיך בכדי להשיג את מטרתו  חשב  תיכנן  פיקד  השקיע  סידר  אירגן  משך אנשים שיתמכו בו מקצועי  לא נשבר והתמיד עד יומו האחרו
14232499,868,2025,בחרתי לתאר את אברהם אבינו  אברהם למרות שכביכול קיבל התגלות אלוהית  סחף אחריו אנשים להאמין במשו שרק הוא האמין בו  הוא התחיל איזושהי דרך מאפס  הוא לא וויתר  או פחד ממה יחשבו עליו  הוא האמין בעצמו ובמה שהוא יודע והצליח לסלול לעצמו ולאחרים דרך אמונה חדשה  ב
14232969,869,2026,הרמיוני גריינגר מסדרת ספרי הארי פוטר היא חכמה  סקרנית  תמיד שואפת ללמוד ולדעת עוד  הרמיוני היא דמות אקטיבית  חברה טובה  מקריבה בשביל החברים שלה  היא רגישה ואנושית  היא אמיצה ובעלת עוז  היא לא מפחדת לנסות דברים חדשים  היא מלאה בשמחת חיים  בחרתי בה כי סדרת
14234128,870,2033,הרצל הינה דמות בעלת   זיקה לארץ  מחוייבות לבני העם היהודי   היה שליח של העם היהודי   אסרטבי לא וויתר לשניה על הקמת מדינה לעם ופעל ביושר וכבוד  
14234252,871,2034,מולן  היא נערה יפינית שרוצה להלחם בצבא למרות שהיא בת וזה לא מקובל בתקופה שלה  בזכות התכונות שלה  בטחון עצמי  אומץ  נחישות  והתמדה  היא מתאמנת  והולכת אחרי החלום שלה ומתגייסת גמחופשת לבן 
14238233,872,2036,הרצל   מכיוון שהביא את רעיונו לידי מימוש  הרצל חזה את מדינת היהודים   האמין ברעיון שלו ופעל להפוך אותו למציאותי  הרצל היה בן אדם מעשי   שלא וויתר וראה מטרת על ובעזרת מוטיבציה גבוה ואבני דרך השיג אותה 
14239370,873,2039,הדמות שבחרתי היא אבא שלי  אבא שלי אדם חייכן  אופטימי  אוהב לעזור  אומר כל מה שהוא חושב  רועש  מצחיק  סוחף  הוא חושב אחרת ולא משנה לו מה אנשים אחרים חושבים עליו הוא מנצל כל רגע ונהנה מכל דבר שהחיים נונתים לו  בחרתי באבא שלי כיוון שהוא ממשיך להוכיח לי שלא מ
14239447,874,2040,הרצל   להרצל תכונות אופי חזקות מאוד   אהבת הארץ רצון לחבר את המולדת ועמידה על דעותיו   אני מאמינה שכל אדם צריך לעשות פשרות ולהתפשר לפעמים אך לעולם לא לוותר על עמדתו האישית ורצונו הפרטי   להרצל יש תוכנות אופי שלטעמי מדהימות   הוא חקר וכתב ולמד וחיפש פתרון
14239595,875,2042,מרטין לותר קינג נראת לי דמות בעלת תוכנות אופי חיוביות כי הוא בן אדם שדבק בדברים שהאמין באמונה שלמה כגון שחורים צריכים להיות שווי זכויות יחד עם  הלבנים בארצות הברית למרות היתנגדות הנחרצת של רבים כמו האמרקאים הדרומים  בארצות הברית  בחרתי בדמות זו כי זהו
14239665,876,2043,אשתו של אילן רמון אני יכולה לדמיין לעצמי שלהיות נשואה לאסטרונאוט זה לא קל בכלל הוא לא נמצא בבית כמעט ועסוק מאוד בעבודתו אך בכל זאת  היא הלכה אחריו ואחרי החלום שלו  לאחר מותו של אילן רמון שהיה קשה ומתוקשר מאוד  בנה אסף התגייס לצהל ואף הוא רצה להתגייס לחיל
14239665,877,2043,אשתו של אילן רמון אני יכולה לדמיין לעצמי שלהיות נשואה לאסטרונאוט זה לא קל בכלל הוא לא נמצא בבית כמעט ועסוק מאוד בעבודתו אך בכל זאת  היא הלכה אחריו ואחרי החלום שלו  לאחר מותו של אילן רמון שהיה קשה ומתוקשר מאוד  בנה אסף התגייס לצהל ואף הוא רצה להתגייס לחיל
14240544,878,2046,פרופסור אלברט אינשטיין הוא אדם שמוערך לא רק בגלל תורת היחסות הכללית והפרטית אלא גם בגלל יחסו לחינוך  משפט מפורסם שלו הינו  הדרך הנכונה לחנך בני אדם היא להיות להם לדוגמה  הוא ראה עליונות באלו הרוצים לחקור ולגלות מעבר למה שידוע  גישה זו של עידוד החיפוש
14240613,879,2047,הדמות שבחרתי בעלת תכונות אופי שהובילו את עם ישראל לגאולה וליציאה מעבדות לחירות  משה רבינו  משה כבד דיבור ועם זאת הוא מצליח להוביל אחרי עם שלם ללכת בדרכי ה ובצניעות רבה עם כריזה גדולה הופך אותם מעבדים לאנשים חופשיים  משה הוא לפי דעתי מנהיג המנהיגים  ה
14240725,880,2049,הדמות שבחרתי היא הרצל  הרצל היה בן אדם שאפתן עם דעות מובהקות שעשה שינוי לא רק בשביל עצמו אלא בשביל הסובבים אותו  היה חלק בלתי נפרד מהקמת המדינה   אחד מהסמלים של מדינת ישראל  האמין בדרכו וחשב חיובי ובסופו של דבר גרם לשינוי 
14240994,881,2050,דמות מציאותית שאני מאוד מעריכה זה בנימין נתניהו  הוא בן אדם שמאוד אני מעריכה אותו   בפעם השלישית שהוא כבר נמצא בתפקיד כראש ממשלה   אישיות שיודעת לדבר  הוא מייצג את העם בצורה הראויה  גם שייצג אותנו נציג בשגרירות ארצות הברית הוא תמיד השמיע את קולו של עמו  כ
14241882,882,2055,סבא שלי הוא דמות מופת מבחינת תכונות אופי  ענווה  צניעות  החוזק הנפשי  החיוך בכל מצב   השלווה התמידית לא משנה כמה גרוע המצב והחכמה  הנכונות של כל מילה שיוצאת מהפה  והיושרה 
14241900,883,2056,יצחק רבין   אומץ לב   נחוש בהחלטתו ודעותיו   אופטימי   רודף צדק
14242072,884,2058,הדמות שבחרתי היא מנחם בגין  זוהי דמות שבמהלך כל ההיסטוריה היא נלחמה על העקרונות ועל ערכיה  היא לא וויתרה אף פעם על דעותיה ואם השיגה את מטרותיה  למנחם בגין יש את תכונות ההנהגה   סמכותיות  דוגמא אישית דבקות במטרה אלו תכונות בעייני מאוד מוערכות  כמו הסיפור
14242114,885,2059,הדמות שבחרתי לתאר היא אחותי  אחותי הקטנה היא המודל לחיקוי שלי  קודם כל היא בן אדם מדהים  רגישה בטירוף לסובבים אותה  אדיבה  נדיבה  אכפתית  חושבת תמיד על האחר וכיצד אפשר להעלות על פניו חיוך  היא אלופת הארץ בטריאתלון לגיל שלה והמסירות והטוטאליות שלה למקצוע מ
14242721,886,2062,בעיני הרצל הוא דמות חיובית  הוא דמות הסטורית ופוליטית  הוא היה חוזה המדינה  הוא הבין שהפתרון לבעיית ההיהודים הוא הקמת מדינה יהודית לעם היהודי בארץ ישראל  במהלך  התהליך להקמת מדינה יהודית הוא לא התפשר וגם לא וויתר  כולם ידעו שהיהודים סובלים ועל מנת להתק
14243471,887,2064,בחרתי בדמות הסטורית רוזה פארקס לפי דעתי היא מהווה דוגמא לאדם אמיץ ונחוש בדעתו היא הלכה אחרי הערכים שהיא האמינה בהם  ונלחמה לשנות את פני העולם 
14243480,888,2065,גלילאו גלילאי המשיך לדבוק בעקרונותיו גם כשהועמד למשפט על גילוייו המדעיים שכדור הארץ הוא הסובב את השמש ולא להפך כפי שהייתה התפיסה  עד יומו האחרון הוא לא נכנע ללחץ לחזור בוא וחי 9 שנים במעצר בית  במשפט אמר ואף על פי כן  נוע תנוע  האמונה המלאה בעצמו  חוסר
14243508,889,2066,בנימין זאב הרצל  אדם אשר היה חדור מטרה  גם כאשר נתקל בסירובים ובהפניות גב  לא וויתר והמשיך לרדוף אחר חלומו וחזונו  למעשה  עד יומו האחרון פעל בכדי להגיש את חלומו  ועשה כל  שביכולתו כדי להגשים אותו 
14243830,890,2068,הדמות בעיניי שיש לה תכונות אופי חזקות וחיוביות זו אמא שלי אני מכירה אותה בכל המצבים  היא אישה חזקה   היא לא נכנעת ולא מוותרת לעצמה בחיים היא גם לא מוותרת לאחרים היא  מסוג האנשים שלא יכולים להשאר אדישים לסביבה היא תראה שמישהו צריך עזרה היא לא תחכה שהוא
14244020,891,2069,הדמות שבחרתי לציין היא הרמבם   הסיבות שבחרתי דווקא בו הן רבות   הרמבם היה אדם שהיה מוכן לעזור ולקבל את כולם   לתת יד ואוזן קשבת לכל אדם הנקרא בדרכו   שונה ממנו ככל שיהיה  נוסף על כל הוא לא היה אדם ששקע אך ורק בלימודי התורה   הוא הרחיב והאמין גם בפילוסופ
