13838825,1584,3643,משה רבינו  היה אדם מוביל בחברה  שתמיד ידע להוביל את עמו רק לטוב  יחד עם כל גדולתו משה רבינו היה עניו   אנשים גדולים וענווים גורמים לי להערצה והערכה 
13838841,1585,3645,חברה שלי  ליטל   לליטל תמיד יש שמחת חיים  גם ברגעים קשים היא תמיד מצליחה לראות את הטוב שבדבר  כשיש עומס ולחץ היא תמיד מוצאת את הדרך היעילה והטובה ביותר להצליח  לליטל יש שאיפות גדולות  ולשמחתה היא מצליחה להגיע לשאיפותיה  בעמל רב  ליטל תמיד חושבת צעד א
13838979,1586,3649,אמא שלי היא מודל לחיקוי שלי  היא אחראית ומסודרת  דואגת לי ולמשפחתי בכל זמן  מסורה ונותנת מעצמה רבות עבורנו  היא רגישה לזולת  אינטלגנטית מאוד  ישרה והגונה  אני מספרת לה את כל התרחישים שקורים בחיי  היא מאוד מעורבת בחיי ומאוד חשוב לי לשתף אותה בכל הנעשה סביב
13839193,1587,3651,מרטין לותר קינג  אני מאוד אוהב דמויות שהלכו עם האמת שלהם ועם הערכים אותם שמו בדגש עד הסוף   אני אוהב אנשים שהיו פורצי דרך והלכו כנגד הזרם וכנגד כל אשר היה מקובל באותו  הזמן על מנת להגשים חזונם  אני חושב שאין דבר העומד בפני המציאות  כלומר אם דבר כלשה
13839301,1588,3653,דוד המלך היה מנהיג גדול  הוא הגיע מתוך העם  והיה עניו לאורך כל תפקידו  למרות המאבק שלו בשאול על המלוכה הוא לא התדרדר למעשים שפלים  ושמר על  התנהלות נקייה בכ המובנים  בנוסף  כאשר הוא טעה וחטא  הוא ידע להודות בטעותו ולנסות  ולתקן את הנעשה  אני מעריכה תכ
13839644,1589,3656,הדמות שבחרתי היא יצחק רבין  ראש הממשלה שנרצח על רקע פוליטי  רבין למד בבית הספר שגם אני למדתי בו וכל חיי גדלתי על ערכיו  רבין הוא דמות לדוגמא בגלל היותו חלוץ  אדם שהוביל מהפכה  שינוי  אדם שנלחם על העקרונות והדעות שלו  אדם שנלחם על השלום  האחווה בין כל הגזע
13840547,1590,3660,מולאן  דמות הערצה שלי מאז שהייתי קטנה  לעומת נסיכות דיסני האחרות מולאן לא חיכתה לנסיך על הסוס הלבן שיבוא ויציל אותה אלא יצאה בעצמה להילחם על המדינה שלה ולהגן על כבוד המשפחה שלה ואביה בפרט  בכך היא הראתה לכולם שבנות הן לא פחות חזקות נפשית או פיזית מבנים ו
13840618,1591,3661,אילן רמון הוא דמות ישראלית מאד חשובה  בגלל השגיו והדרך שהוא עשה  ראש הממשלה לשער בגין  אדם נחוש חכם ונבון שידע להוביל את עמו וידע גם לשאת  בהשלכות החלטותיו 
13840618,1592,3661,אילן רמון הוא דמות ישראלית מאד חשובה  בגלל השגיו והדרך שהוא עשה  ראש הממשלה לשער בגין  אדם נחוש חכם ונבון שידע להוביל את עמו וידע גם לשאת  בהשלכות החלטותיו 
13840648,1593,3662,מנחם בגין  היה ראש ממשלת ישראל  ראש הממשלה הראשון של הליכוד וגם הראשון שעשה שלום עם מדינת אויב מצריים   זהו אדם שבמשך כל חייו נתן מעצמו ומבריאותו למדינה החל מתקופת האצל ועד לראשות הממשלה  איש אמיץ שהקריב הרבה למען שלום עם מדינה אוייבת  כאשר לכשל במלחמת ל
13841083,1594,3666,נלסון מנדלה זכרונו לברכה היה אדם חיובי מאוד  האמין בסובלנות  בהידברות בקבלה של האחר  הוא האמין שבכל אחד יש טוב  שהחברה שלנו צריכה להיות חברה מקבלת  אוהבת  רדף צדק והיה לו חשוב לשנות דברים שגויים בחברה שלנו  הייתה לו ביקורת לאלימות מיותרת  לשנאה שקיימת
13841279,1595,3668,חנה סנש  העיזה לשנות את חייה ולחיות כפי שהיא מאמינה  הלכה עד הסוף עם הדברים שהיו חשובים לה  הייתה מוכנה לתת מעצמה לאנשים אחרים  אני חושבת שהיא מהווה דוגמא להרבה אנשים ובייחוד נשים 
13841395,1596,3670,יצחק רבין  בנאדם שהולך תמיד אחרי הדעות והדברים שהוא מאמין בהם  בנאדם ישר שהולך אחרי האמת שלו ופועל על פיה  בנאדם שנותן המון מעצמו לחברה ולמדינה   רבין היה בנאדם מאוד טוב בעייני ולמרות שלא הכרתי אותו  אני חושבת שהוא בהחלט מודל לחיקוי עם תכונות שכל אח
13841490,1597,3671,יגאל אלון   איש רוח ואיש מעשה   איש צבא ואיש חברה   איש אהבת הארץ ואיש שמוכן גם לותר עליה תמורת שלום  איש שחי בין יהודים וערבים בטבעיות ולא חשב איפה ואיפה  גדל במושב אך הקים קיבוץ  מצביא ומדינאי  משכמו ומעלה  הוא השאיר מורשת ענפה אחריו  פירוט רעיונות ותכנ
13841490,1598,3671,יגאל אלון   איש רוח ואיש מעשה   איש צבא ואיש חברה   איש אהבת הארץ ואיש שמוכן גם לותר עליה תמורת שלום  איש שחי בין יהודים וערבים בטבעיות ולא חשב איפה ואיפה  גדל במושב אך הקים קיבוץ  מצביא ומדינאי  משכמו ומעלה  הוא השאיר מורשת ענפה אחריו  פירוט רעיונות ותכנ
13841616,1599,3672,כריסטיאנו רונאלדו הוא כיום שחקן הכדורגל הטוב בעולם  לא מדובר בבחור הכי מוכשר במקצוע  להיפך  מה שעושה אותו לטוב בעולם היא בראש ובראשונה העובדה שאין אדם שמשקיע יותר ממנו  הוא פיתח את עצמו בכל דרך אפשרית  בחר לנצל עד תום הזדמנויות להתקדמות שהגיעו לפניו והביא
13842495,1600,3676,אליעזר בן יהודה הוא דמות המצטיירת לי כדמות חיובית  ממה שקראתי ואני מכירה הוא בן אדם חרוץ וחדור מוטיבציה  לא סתם הוא מכונה מחייה השפה עברית  הוא הקדיש את מפעל חייו למען השפה העברית הוא היה אדם ציוני  הוא שאף גבוה ולא ויתר  גם כאשר לא היה לו קל  אני מאוד מע
13842597,1601,3679,מרגרט תאצר   אישה חזקה בעלת השפעה וכריזמה   איננה וויתרה עד שארצות הברית לקחה אותה ברצינות   לקחה תפקיד חשוב במהלכים הפוליטיים ודבקה בדעתה   הייתה החלטתית   אמיצה וקשוחה  אישה חזקה אשר תרמה לקידום מעמד האישה   והכלכלה בכלל  בחרתי בה משום שהיא דמות חזקה  
13842755,1602,3681,דמות שנראת לי בעלת תכונות אופי חיוביות הוא הרצל לא יודעת להעיד ככ טוב על תכונות האופי שלו אבל יודעת להגיד שהבן אדם תרם המון למדינה  נתן מה שביכולתו   גם אם לפעמים היה קשה לעולם הוא לא וויתר על החלום והאמין בעצמו  תכונות אלו שהיו להרצל מובילות בן אדם להצל
13843078,1603,3684,בחרתי בפורסט גאמפ זוהי דמות בדיונית מהסרט המפורסם  פורסט גאמפ הוא אדם טוב לב שגם אם לא תמיד הוא מתכוון לכך  הוא תמיד מצליח לעשות הכל על הצד הטוב ביותר ותמיד לראות הכל בצורה חיובית ואופטימית  במהלך הסרט הוא נאלץ להתמודד עם המון קשיים אבל אף פעם הוא לא הפס
13843174,1604,3686,אמא שלי התחתנה בגיל 17 וילדה אותי בגיל 18  היא עלתה לישראל בתור ילדה בת 18 אך כיום בגיל 38 יש לה שלושה ילדים  בית ותואר  אני חושבת שאמא שלי היא אדם מאוד חזק שעבד קשה כדי להגיע לאיפה שהיא היום  היא מאוד אחראית ועקשנית ותמיד משיגה את מה שהיא רוצה וצריכה ב
13843194,1605,3687,הדמות שבחרתי היא רסן רועי קליין  שהיה סמגד בגדוד בגולני  במהלך מלחמת לבנון השנייה הוא קפץ על רימון כדי שחייליו לא יפגעו  הקצין היה מוכן לתת מעצמו  כדי שאחרים לא יפגעו  וזה דבר שמאוד נגע בליבי  הוא הראה במעשה זה נחישות  תעוזה  הדבקות למטרה  מנהיגות ואכפת
13845245,1606,3696,הדמות שבעיני נראית חיובית היא יצחק רבין  דמותו תמיד מזכירה לי את הרצון העז לשלום בין כולם  להבאת הצדק והפסקת האלימות שהם דברים שמבטאים דברים שליליים  הוא תמיד רצה לטובת כולם בלי אינטרסים ותמיד שאף להגיע רחוק 
13845330,1607,3698,האדם שבחרתי לתאר הוא ראש ממשלת ישראל בנימין נתניהו  בדמות זו אני מזהה מספר תכונות אופי הנראות לי חיוביות כגון כריזמה  נחישות  יכולת  התבטאות מול קהל  תפקוד במצבי לחץ וביטחון עצמי  אדם זה מייצג את מדינת ישראל במציאות שאינה פשוטה  במהלך התבטאויתיו מול קה
13846814,1608,3702,הרמבם שילב בצורה מושלמת בין תורא למדע היה לו אינטליגנציה גבוה  אהבת ישראל והיה תורם לעולם המדע  היהדות ולקהילה
13847972,1609,3703,הארון כהן הגדול  אח של משה רבינו  הוא היה דמות ענק בהסטוריה של עם שלנו  בלי גאווה  מאוד פשוט וקרוב אנשי עם  הוא היה מנסה להקים שלום בין איש לחברו  ובאותו זמן הוא היה משרת גם את סדיר שלו בבית משכן  אני גם חושב שלא משנה באיזה דרגה אתה  לא צריך להיות עם ראש
13900566,1610,3707,בנימין נתניהו   ראש הממשלה הנוכחי שלנו   לפי דעתי הוא אדם חזק מאוד בעל יכולות יוצאות דופן   אדם שעושה מה שהוא חושב לנכון לו ולמדינתו  אדם שקול שפועל מחשיבה ולא מפחד למרות המודעות לכך שישנם סובבים שבוחנים אותנו   מנהיג את המדינה זמן רב ולא בכדי  ספג מב
13901195,1611,3708,אבא שלי  אבא שלי הוא בן אדם מאוד יצירתי ואומנותי  הוא צנוע ושלו  הוא תמיד מדייק בזמנים  לדוגמא  השעון שעל ידו מכוון כמה דקות קדימה בשביל שהוא אף פעם לא יאחר  הוא רגיש מאוד לסביבה שלו  לבני אדם וגם לבעלי חיים  בחרתי באבי כיוון שהוא היווה לי תמיד דוגמא בחיי
13905201,1612,3710,ישנם שתי אנשים הראשון נלסון מנדלה שנלחם על העקרונות שלו ורצה את החופש המגיע לו ולא וויתר על הכבוד שלו גם שישב בכלא שנים רבות גם שביקשו ממנו לחזור בעצמו הוא לא עשה זאת בשביל העם שלו והשני יש סרט עם וויל סמית שנקרא המרדף אל האושר סיפור אמיתי על בן אדם שהגי
13905582,1613,3711,דוד המלך  דוד המלך יצא כנגד כל סטיגמה אפשרית  הוא היה קטן ואף אחד לא האמין בו ובכל זאת הוא הצליח לגבור על גוליית הגדול ולימים להיות האדם שממנו יצא מלך ישראל לעתיד  דוד המלך היה אדם רגיש ואנושי שעשה טעות והודה בה  תכונה זו אני מאוד מעריכה אצל בני אדם ובפר
13905618,1614,3712,בחרתי בדמות המצויירת מולאן  שלמרות שהיא דמות דמיונית אפשר ללמוד ממנה הרבה  מולאן היא אישה חזקה שמוכנה ללכת נגד מוסכמות החברה על מנת להציל את אביה החולה  תכונותיה החיוביות  תעוזה  אומץ  יוזמה  אחריות  דבקות במטרה  הליכה אחר האמת שלה  מולאן לא נכנעת לתכת
13905780,1615,3715,אבא שלי הוא בן אדם מאוד חיובי כי למרות כל מה שעבר בחייו הוא נשאר אופטימי וגדל משפחה מעולה  כלומר אחרי שנפגע בתאונת דרכים ואבד את אחת מעיניו     ואבד אחד מהבנים שלו אחש שלי אמל זל בתאונת דרכים ואבד שני אחיינים שלו בצהל וגם אחד מהדודים שלו והוא יש לו את
13906299,1616,3716,נשיא המדינה לשעבר שמעון פרס  איש מכובד  לדעתי גם מנהיג בעל דיעות מרשימות ונאורות  את הנואמים שנאם בתקופה האחרונה מעידות על כך כמה שהוא איש חכם אינטלגנט ומבין עניין 
13907373,1617,3718,מרטין לותר קינג דמות שאני חושב שהיא חיובית בן אדם שנלחם למען זכויות אדם בארהב  כל האנשים בעולם נולדו שווים לכן לא צריך לעשות אפליה בין האנשים כולם אזרחים שווים 
13908271,1618,3721,הדמות שבחרתי היא עמנואל מורנו זל  שהיה סגן אלוף בסיירת מטכל וקראתי עליו רבות שהיה מנהיג גדול ובן אדם שאפתן ונחוש שאחרי האימונים הכי מפרכים וגם ההצלחות וגם הכשלונות היה מנצל את ההפסקה שלו כדי לנתח נקודות לשימור ולנקודות לשיפור  איפה היו הטעויות  איך אפשר
14179914,1619,3723,דמות שנראית לי חיובית היא ספיידרמן  ספיידרמן שומר על זהותו כסודית  לא רוצה שאנשים יהללו אותו ואוהב את חייו הפרטיים  הוא עוזר למשטרה לתפוס פושעים ומסכן את חייו בעזרה זו  הוא אינו חושב רק על עצמו ומקריב מעצמו בכל פעם מחדש  הוא שומר על זהותו כסודית   צנו
14179925,1620,3724,הענווה וחוסר החיפוש אחר כבוד של  מנחם בגין  הגאווה היא תכונה שאני חוטא בה ומנסה לתקן אותה אצלי  יש משהו כלכך אמיתי בתרומה של מנחם בגין שנראית דווקא בענווה ובפשטות שלו  כאילו הוא עושה את מה שהוא עושה בגלל שהוא חשוב ללא כל סיגים או אינטרסים נלווים 
14179952,1621,3725,רז  חברה שלי  רז בחורה מאוד בוגרת  שאפתנית ועיקשת  רז יודעת לשמור על עצמה בכל מצב ויודעת גם איך לדבר ומה להגיד בשביל להשיג את מה שהיא רוצה  לרז יש שאיפות להמשך חייה וכבר עכשיו שהיא חצי שנה לפני שחרור  היא מתחילה לברר לגבי קורסים ולימודים בהם תרצה להרחי
14180097,1622,3728,דמות דימיונית היא קפטן אמריקה  בעל תכונות של משמעת  חשיבה לפני צעדים  דאגה לזולת ובעל יכולות ניהול ופיקוד 
14180194,1623,3731,אבא שלי הוא אדם חיובי אופטימי וחברותי מאד הוא מאד אוהב להצחיק אנשים ותמיד יעזור לכל מי שיפגוש  גם אדם זר  הוא איש חם ואוהב ותמיד שם את המשפחה בראש  אבא שלי עבר חיים לא פשוטים גדל בבית שלא היה בו הרבה ולבסוף הפך לאיש מצליח  הוא תמיד חושב על טובתם של אח
14180364,1624,3733,יצחק רבין   מצביא  מנהיג  איש חזק
14180541,1625,3734,דמות אשר חביבה עלי היא וינסטון צרציל  ראש ממשלת בריטניה ממלחמת העולם השנייה  צרציל היה אדם חזק ותקיף אשר זיהה מהתחלה את האיום הנאצי על העולם ולבסוף פעל  על מנת לנצח במלחמה כל מחיר  התכונות האלו של דבקות במטרה  כריזמה  מנהיגות ודאגה לזולת חשובות ומר
14181069,1626,3739,בחרתי לתאר את שמעון פרס כדמות של מנהיג חשוב ודגול בעיני  שמעון פרס הוא אדם נעים הליכות  מנומס  עדין ועדיין נחשב כאסרטיבי  אדם שיודע לעמוד על שלו גם אם דעותיו שונות מכל השאר  בעיני הוא דמות לחיקוי מכיוון שעל מנהיג לשאוף לסחוף את העם אחריו  לעמוד  מאחורי
14181449,1627,3743,הדמות שבחרתי היא הרצל  כשאני חושבת על דמות היסטורית עם תכונות אופי חיוביות אז השם שישר עולה לי זה הרצל  הרצל עבורי מסמל אדם חדור מוטיבציה  בעל מטרה  כריזמתי  מוביל  לקח רעיון שהיה קטן והצליח להביאו לתודעה של המון אנשים  מהנלמד בהיסטוריה תמיד מתארים אותו כ
14182452,1628,3746,אמא שלי   אישה חזקה שתעשה הכל למען המשפחה  מעבר לתרומתה הרבה במסגרת העבודה היא מתנדבת בקהילה  מעבר לדמות מחנכת שצריכה להעניק כלים לחיים לילידה  היא גם חברת אמת ואוזן קשבת  היא חברותית ומתחברת בקלות  בעלת ביטחון עצמי גבוה  שואפת למצויינות ומשמשת דוגמה אישי
14183415,1629,3749,אופרה ויינפרי  עברה קשיים רבים בחייה ובמקום להשבר ולהתחבא בחרה לא לתת לדברים הרעים להשפיע על חייה וכעת המטרה היחידה אשר מובילה אותה היא העזרה לזולת  לעודד אנשים לא להיות במקום הנמוך והשפל ולצאת ולעזור לעצמך ולסובבים אותך 
14184023,1630,3751,יצחק רבין לחם במדינות ישראל  אהב את המדינה והצבא ורצה כל הזמן לתת מעצמו  הוא דאג לחיילים שלו והיה ידוע כמפקד אכפתי והומני  הגן על מדינת ישראל בכל המלחמות  אך האמין שצריך להפסיק את מרחץ הדמים ולחתור לשלום  הוא האמין בשלום המדינה ובשכנות טובה עם המדינות
14186882,1631,3756,הדמות שבחרתי לתאר היא יאנוש קורצאק  קורצאק הינו דמות היסטורית שעשה הרבה מאוד לטובת ילדים בשואה כשלא היה אף אחד אחר שידאג להם  הוא שם את הילדים במקום הראשון ואף הוא לקח צעד אחורה ובסופו של דבר כאשר הציעו לו להשאר בחיים ולשלוח את  הילדים למוות הוא הלך יחד
14187803,1632,3761,יאנוש קורצאק הוא דמות בעלת תכונות אופי מוערצות בעיניי  במיוחד בשל ההתמדה שלו  ההקרבה של חייו למען אותם ילדים שניסה להציל  האופטימיות שלו עצמו והעידוד של הסובבים אותו למרות הזוועות שעברו 
14188745,1633,3764,הרצל אם תרצו אין זו אגדה הרצל שינה את כל ההסתכלות שלו על החיים  כי הוא הבין שאיך שהוא חיי ומה שמראים בחוץ זה לא מה שבאמת קורה  הוא האמין בדרך שלו וחתר כדי שדברים שהוא מאמין בהם יקרו  החתירה הזו לדברים שאנו רוצים ומאמינים בהם זה משו שאין לכל אחד את ה
14189249,1634,3766,דמות דמיונית בעלת תכונות הנראות לי חיוביות היא ללא ספק טיריון לאניסטר מסדרת הספרים שירים של אש וקרח  בדומה לדוד שלי טיריון הוא טיפוס מאוד ציני והומוריסטי בחברת אנשים וגם מאוד חד ושנון  לעומת זאת כשזה מגיע לקשרים האישיים שלו  רואים את זה בסדרה עם המאהבת
14189265,1635,3767,הדמות שבחרתי בה היא נשיא המדינה לשעבר שמעון פרס  אני רואה באדם זה דמות לחיקוי והערצה שמעון פרס תמיד שם את ערכי האדם לפני הכל והיה מתעקש להוציא את הצדק לאור  הרצון העז שלו למהלך כהונותיו השונות להשגת השלום עם מדינות ערב יכול להעיד על דביקותו במטרה ואמו
14189303,1636,3769,יאנוש קורצאק  הוא לאורך כל הדרך עד מותו שימש לילדים מנהיג ודמות אב  הוא לא עזב אותם למרות שידע שישלם על כך בחייו  הוא הרגיע ונתן להם ביטחון עד שרצחו אותם 
14189392,1637,3772,אח שלי  אח שלי בעל יכולת גבוהה מאוד וביטחון עצמי  אח שלי מציב לו מטרה והולך אחריה עד הסוף מבלי להתייאש  אח שלי בן אדם נורא לא עצלן ולעולם לא אשמע אותו מתלונן שקשה לו  אני חושבת שאלו תכונות חיובות מאוד בבן אדם והם אלו שיובילו אותו רחוק 
14189444,1638,3773,מנחם בגין זל   ראש הממשלה לשעבר  מצד אחד  לא התבייש לעמוד על שלו ועל רצונותיו של העם ושל בוחריו בשנות ה70  ומצד שני כאדם אחראי מסור ושקול  כפי שהתגלה בהסכמי השלום עם מצרים  
14189608,1639,3774,יאנוש קורצאק  יאנוש קורצאק הוא דמות הסטורית ממלחמת העולם השנייה  הניהל בית יתומים לילדים בפולין במהלך השואה  בנקודה כלשהי במלחמה יאנוש קורצאק התבשר כי ילדי בית היתומים עומדים להישלח אל מותם  הוא בחר לנסוע יחד איתם ולמות לצידם  בחרתי ביאנוש קורצאק מפני
14189633,1640,3776,בחרתי בפו הדוב  פו הוא דמות אופטימית  הוא אוהב את החברים שלו ותמיד מוכן לעזור להם  הוא יצור הרפתקני  חוקר ומאוד חכם  לא מהסס לבקש עזרה ונהנה מהדברים הפשוטים של החיים 
14189990,1641,3777,בחרתי ביצחק רבין  דמות הסטורית   כיהן כראש ממשלת ישראל  ונרצח בגלל דעתו ומעשיו הפוליטים  אני חושבת שהוא דמות בעלת תכונות אופי להערצה  הוא אמר את דעתו ולא ויתר  חתר לשלום  אהב את המדינה  היה אסטיבי וחדור מוטיבציה ומטרה 
14190790,1642,3780,בחרתי לתאר את אמא שלי מכיוון שהיא מהווה לי דמות לחיקוי והיא בעלת תכונות אופי הנראות לי כחיוביות  אמא שלי יועצת ארגונית ומרצה לענייני ניהול במכללת האקדמית הדסה  אני רואה המון תכונות אופי הנראות לי כחיוביות בה הכוללות עצמאות  כושר מנהיגות ועמידה אל מול קה
14191058,1643,3781,אלברט איינשטין  אדם משכיל  אשר מעוניין תמיד לחקור  להעמיק את הידע שלו ולגלות מסקנות חדשות  כמו כן  מדובר באדם מנומס  בעל עולם תרבותי נרחב  הוא היה גם כנר  טוענים כי מדובר בכנר טוב   ובעל זיקה לארץ ישראל  על אף שסירב להצעה להיות נשיא מדינת ישראל  ולעם הי
14191306,1644,3782,סבתא שלי מצד האמא  אישה בעלת תכונות חיוביות  אישה אחראית בעל ראש פתוח מקבלת כל אחד  מבינה כל בן אדם  עוזרת ונותנת כל מה שהיא יכולה לתת  ממוקדת מטרה  יש לה רצון להפוך את העולם לטוב יותר  לחברה צודקת  אישה אצילית 
