12266249,2320,5488,רועי קליין  מספרים שכשירד ממדים והלך ללמוד בישיבה כולם היו בטוחים שהוא ממש חנון  שדרש מעצמו תמיד ולא נח כשלא הצליח להשיג משהו שהציב לעצמו  עצם הבחירה שלו בשבריר שניה להקריב את חייו למען חייליו מעידה על העובדה שכנראה הוא חי כך כל רגע ורגע מהחיים שלו בצו
12266347,2321,5489,סבתא שלי  אישה מדהימה  כל הזמן מעודדת  תומכת  אוזן קשבת לכל דבר ובכל זמן  אוהבת לעזור  אוהבת לפנק  חזקה  מתמודדת עם דברים  סבתא שלי בת 78 מתמודדת עם קשיים יומיומיים ולא מוותרת לרגע  עושה את הכל על הצד הטוב ביותר  יודעת ללכד את כל המשפחה יודעת להגיד מה לא
12268317,2322,5495,מרים פרץ  אשה שאיבדה שנים מבניה במלחמות ישראל ובתווך בעלה נפטר  ניא ממשיכה לפעול ולעשות מתוך אמונה גדולה בעם ישראל בארץ ישראל  היא דבקה במשימתה והיא תמיד נשארת חיובית ומנסה לחנך ככה גם אחרים  היא כל הזמן מחפשת להשפיע כמה שיותר 
12268668,2323,5496,מייקל גורדן  שאיפה למצוינות בכל נושא ותחום שבחר בו 
12268693,2324,5497,יאנוש קורצאק  יאנוש האמין בדרכו החינוכית ודבק בה עד הסוף  הוא לקח אליו יתומים יהודים חסרי כל ונתן להם הזדמנות שנייה לחיים  הוא חינך אותם להגדלת ראש ואחריות על עצמם ומעשיהם  וראה בהם את מי שהם לא הצליחו לראות בעצמם  הוא שמר על תקווה ואופטימיות לכל אורך
12268869,2325,5498,שמעון פרס  בחרתי אותו בעקבות סיפור הכור הדימונה   אפ על פי שכל חברי הממשלה היו נגד בניית הכור  ולא האמינו שזה אפשרי בכלל הוא ובן גוריון הלכו כנגד כל הסיכויים ובסופו של דבר הפרייקט יצא לדרך  התכונות שלו שאני אוהב את עקשנות ציונות  הולך עם האמונה שלו לא מוו
12268954,2326,5500,אמא שלי היא אישה חזקה  באופי   חכמה  נבונה  דעתנית ואנושית  חושבת על הזולת   היא בשבילי נראית כדמות חיובית כיוון שלדעתי נפש חזקה  חכמה ואנושיות הן תכונות המפתח ללהיות קצין טוב ואדם טוב בפרט 
12269234,2327,5501,משה רבנו משה היה גדול המנהיגים של עם ישראל והמנהיגות שלו התבטאה במאפיינים שצריכים להיות למנהיג כמו דאגה לחלש ועזרה הדדית ידע לחבר בין עם ישראל ולגרום לאהבה וגיבוש בקרב העם  משה גם היה העניו מכל אדם תכונה שאני מאוד מעריך אצל מנהיג היא צניעות שמנהיגות ל
12269262,2328,5502,חנה סנש  צנחנית לפני קום המדינה  אישה בעלת אומץ ותושייה  רצון לעזור ואסרטיבית  בעלת ראש על הכתפיים  מנהיגה ומובילה שושלת של לוחמות אחריה 
12269928,2329,5504,מרתין לותר קינג  העברתי עליו שיעור לחיילים שלי  מדהים בעיניי בן אדן שהולך נגד כל הסיכויים ומאמין בעצמו כל כך עד שהוא מגשים את המטרה שלו  וסופג כל כך הרבה אש בדרך
12270470,2330,5508,אני חושבת שפו הדוב הוא דמות מצויירת חיובית מכיוון שהוא תמיד שמח בחלקו בסופו של דבר  הוא מצליח להסתכל על הדברים בצורה חיובית ואני חושבת שזאת תכונת אופי חשובה מאוד מכיוון שהמון פעמים במהלך שרותינו הצבאי ובאזרחות בכלל אנחנו לא נהיה דווקא מרוצים מהמקום שבו אנ
12271829,2331,5512,הנביא יהושוע בן נון אשר מצטייר מצד אחר בתור אדם עדין נפש נביא למדן ושקדן בתורה ומאידך מנהיג דגול בזמן לחימה אשר הוביל את בנ ישראל להרבה נצחונות בארץ ישראל
12271964,2332,5513,הרב אברהם יצחק הכהן קוק  הרב הראשי האשכנזי הראשון של מדינת ישראל   להלן  הרב  פעליו הרבים ומשנתו הסדורה מהווים מופת בעבורי  בנפש הרב בערה האהבה לכללות עם ישראל ומדינת ישראל  ופעל רבות לאיחוד העם  בסיורו בצפון  אפילו קיבוצניקים רבים  מהסוג האידיאולוגי ש
12272045,2333,5516,נלסון מנדלה כי הוא לא פחד להאמין ולהילחם על מה שהיה חשוב לו
12272070,2334,5518,מנחם בגין  היה איש צנוע ראה תמיד את טובת הכלל  פעל באמונה בדרך שלו ולא ויתר על ערכים שלו למרות שהיה לאחור בחלק מהמקרים 
12273360,2335,5522,משה רבנו  היה אדם פשוט וזה חשוב לדעתי פשוט בן אדם טוב  הוא לא רדף אחרי הכבוד ולמרות צניעותו הצליח להוביל ולהנהיג את עם ישראל בתקופה לא פשוטה  כמו כן אומץ רב אחריות  הוא היה אנושי והבין את זה שהוא יכול לטעות 
12273417,2336,5523,הדמות אותה בחרתי היא מולאן  דמות מסרט מצוייר  מולאן לדעתי מייצגת משפחתיות  אמונה בדבר ועבודה קשה  המניע הראשוני שלה  הוא הגנה על אביה  מה שמצביע על משפחתיות  אנושיות  חום ואהבה  שהם לדעתי המניעים הנכונים ביותר  מניעים שמגיעים מהלב  היא מתגייסת לצבא שכולו
12273550,2337,5526,בחרתי בשמעון פרס  הסיבה לכך הוא שאני רואה אותו כדוגמה אישית  איש מוערץ  דגול  פיכח מאוד  מחושב וצנוע   לא סתם הוא היה שנים נשיא המדינה למרות גילו המבוגר  כשהיה מתראיין ונושא ניאומים היה ניתן להבחין בצניעותו הרבה וחוכמת החיים שלו 
12273871,2338,5531,ספיידרמן  אמיץ  אוהב  דאגן  הוא בסהכ דמות מאוד פשוטה אבל נותן הרבה  שומר על דודה שלו שגדלה אותו  לומד  חושב על אחרים ולא רק על עצמו  משתמש בכוח שלו בחכמה ולא סוטה מדרך הישר 
12275591,2339,5534,מרתין לותר קינג  מרתין האמין שניתן להשיג שיוויון זכויות ללא אלימות  הוא האמין והיה אופטימי שהוא יצליח והוא צדק המטרה הושגה ללא אלימות 
12275636,2340,5535,לפי דעתי מולאן היא דמות בעלת תכונות אופי חיוביות  היא דמות חזקה שעומדת על שלה  דואגת לסובבים אותה ובייחוד למשפחתה  דבקה במטרה  לא מוותרת  לוקחת סיכונים ומוכנה לסכן את עצמה לטובת הזולת  מולאן התגייסה למלחמה במקום אביה המבוגר בכדי להציל אותו ובסופו של דבר
12275743,2341,5536,סופרמן  בעל תכונות חיוביות כגון לעזור לזולת  להגן על אזרחים  דואג  אכפתי 
12275756,2342,5537,הרצל כדמות היסטורית   בעל תכונות אופי חיוביות רבות  הרצל שהאמין בחלום הציונות לא התפשר ולא וויתר על חלומו   בלי קשר לסיכויו  הרצל היה אדם נחוש שהאמין בצדקת דרכו והלך עם אמונותיו  
12276619,2343,5540,הרצל מכיוון שהוא נלחם למען הקמת המדינה וזכותו אנחנו פה אז אני חושב שאנחנו חייבים לו המון כבוד ותודה
12276902,2344,5542,יצחק רבין  מנהיג גדול שלא פחד מתגובתם של אחרים  ידע להוביל אחריו להצלחה מדינה שלמה  ידע לקבל החלטות נכנות ולנצח כמו למשל במלחמת ששת הימים כאשר היה הרמטכל  ידע לראות ראייה רחבה יותר לעתיד טוב יותר  ידע להודות בטעויות שלו ולשאת באחריות 
12276906,2345,5543,דמות בעלת תכונות אופי הנראות לי כחיוביות היא משה רבינו  אדם צנוע ומוכשר  מסור לאנשיו ושם את צרכיו לפני הצרכים האישיים שלו  תחילה אדם זה לא האמין בעצמו שיוכל להוביל עם שלם  אבל לבסוף הפך לאישיות תנכית גדולה שזכורה עד היום בזכות מעשיו 
12277304,2346,5545,יצחק רבין   דבקות בשלום ופיוס בין מדינות ודעותיו השונות  מרטין לותר קינג   על כל מה שהוא היה למען שיוויון   האידיאולוגיות  היכולת לבטא את עצמו והמטרה שהקריב עצמו למענה  ליאונידאס  מהסרט 300    מנהיג כריזמטי  שהוביל את חייליו בחוכמה למלחמה שהייתה נראית
12277304,2347,5545,יצחק רבין   דבקות בשלום ופיוס בין מדינות ודעותיו השונות  מרטין לותר קינג   על כל מה שהוא היה למען שיוויון   האידיאולוגיות  היכולת לבטא את עצמו והמטרה שהקריב עצמו למענה  ליאונידאס  מהסרט 300    מנהיג כריזמטי  שהוביל את חייליו בחוכמה למלחמה שהייתה נראית
12277521,2348,5547,בתכונות האופי אני מתארת את אחותי הקטנה  היא ילדה חברותית מאוד ולומדת מהר  היא חכמה ונבונה ויודעת בדיוק מה היא רוצה ולאן היא רוצה להגיע  אופק ילדה רגישה לצורכי הסובבים אותה  היא פרפקציוניסטית אבל יודעת גם להתגמש 
12277867,2349,5549,יצחק רבין   הייתה לו דרך שלה הייתה תומכים ומתנגדים ולא חשוב מה  הלך הוא בדרכו ובהשקפת עולמו שלו ולא הושפע מאחרים ועשה את הכל על מנת להשיג את מטרתו והכל בדרך הוגנת וערכית 
12278268,2350,5555,הדמות היא דמיונית ספיידרמן  ספיידרמן גיבור ילדים אבל יש לו תכונות חיוביות כמו עזרה לזולת הגנה על החלש צניעות עבודה קשה  אני מאד אוהב את התכונות האלו של צניעות ועזרה לסביבה ועבודה קשה בשביל להגיע לתוצאות ובגלל זה בחרתי בו 
12278645,2351,5558,נלסון מנדלה  התחיל את חייו כאדם פשוט ונלחם על דברים שהוא מאמין בהם כנגד כל הסיכויים  ישב 27 שנים שלמות וארוכות בכלא עד ששוחרר והשיג את מטרתו  חלקית   שיוויון בין בהירי עור לכהי עור  אמנם הייתה לו תמיכה של רבים אבל בסופו של דבר את עונש המאסר הארוך הוא ריצה
12278856,2352,5560,יצחק רבין   הרצון ועשייה שלעשות משהו שאתה מאמין בו   משהו שכבר מנסים לעשות אותו הרבה זמן בלי הצלחה  ובדרכים שלא תמיד נראים נכונים לעיני כולם אבל נכונים לפי הדרך שהוא מאמין בה 
12278872,2353,5561,יאנוש קורצק  יאנוש קורצק היה בן אדם מדהים בן אדם שהלך עם האמת שלו עד הסוף הוא פשוט החליט שאם ילדי המעון שלו ילכו לאבדון הוא הולך איתם למרות שהוא יכל להינצל ולמרות שאם הוא יילך איתם זה לא ישנה דבר למרות זאת הוא החליט שהוא לא עוזב אותם כול השנים בגטו הוא פי
12279604,2354,5568,ווינסטון צרציל  היה אדם בעל כושר מנהיגותי יוצא דופן ונואם מצוין  נורא קל לי להיזכר בו כששואלים על דמות היסטורית בגלל שהיו לו נאומים בלתי נשכחים בתקופת מלחמת העולם השנייה  הוא ידע להציב לעצמו יעד קשה  להמשיך להאמין  לא להתפשר ולא להיכנע  ידע להוביל את הא
12806465,2355,5570,הרצל  על אף הקיום של תנועות ציוניות שהיו קיימות בתקופתו  הוא היה הראשון שאיגד את כולן והחל בפעולות פרקטיות לקידום מימוש החזון הציוני של יישוב הארץ   כינוס קונגרסים  ביקורים אצל שליטים ואנשי מפתח  כתיבת ספרים ומאמרים וכן הלאה  תכונות האופי הנראות לי כחיובי
12806936,2356,5572,לדוגמה אלכסנדר הגדול  שהיה דבק במטרה ובעל כבוד לכל הסובבים אותו  ונחישות חסרת גבולות לכן הגיעה לאן שהגיעה  ותופס מקום מרכזי בהיסטוריה העולמית  אדם נוסף הוא נורמן פוסטר אדריכל ומהנדס געוני שתרם רבות להתפתחות המשמעות של האדריכלות  אדם מכובד ונחוש  ההורים של
12809835,2357,5574,דמות שלדעתי היא בעלת תכונות אופי חיוביות היא הלן קלר  הלן קלר הייתה אמריקאית חירשת  אילמת  עיוורת  מגיל ינקות  שלמדה לדבר ונתנה הרצאות שלמות בפני קהל רב והקימה קרן תמיכה באנשים בעלי מוגבלויות  היא אישה אמיצה  אופטימית  לא התייאשה ממצבה   כריזמטית  חרוצה ו
12809966,2358,5575,מרדכי אנילביץ אדם דגול שנאבק בשביל משהו מאמין נגד כל הזרם ופעל מתוך ידיעה שמה שהוא מבצע יכול לגרום למותו אך עדיין פעל למען מטרה מסויימת שאף להשיג את מה שהוא רוצה וגם אם לבסוף לא צלח בזה הצליח להשאיר חותם מעצם הנסיון לשנות את המצב הנוכחי 
12810190,2359,5577,בחרתי באמא שלי   היא מסמלת עבורי דמות חיובית בין בהשפעה שלה עלינו  עליי ועל אחיי  ועל התלמידים בבית הספר והזולת   היא משמשת עבורי כדמות לחיקוי  תמיד עוזרת לזולת   מסתכלת על הכל על הצד החיובי   מאמינה גם בבלתי יאומן  
12810214,2360,5579,דמות  סופרמן  בחרתי בו כי הוא תמיד עוזר לכולם נלחם נגד הרעים וכולם אוהבים אותו
12810216,2361,5580,בנימין נתניהו  ראש ממשלת ישראל  הוא תמיד שאף להגיע כמה שיותר גבוהה  היה לוחם בסיירת מטכל  למד באוניברסיטת הווארד ונמצא כמעט תמיד בפרונט של הפוליטיקה בישראל  ראש ממשלת ישראל בפעם השלישית   אדם רציני ואחראי ששואף תמיד למצויינות 
12810284,2362,5581,יצחק רבין לדעתי היה דמות בעל תכונות אופי חיוביות  הוא היה מנהיג חזק והאמין בדרכו  הוא היה בן אדם ישר שמכבד את עצמו ואחרים  מה שהכי טוב בו לדעתי היה שהוא ידעתי להיות תקיף וחזק אבל גם האמין בשלום ולא פחד לנסות להביא את השינוי 
12810466,2363,5584,אבא שלי תמיד עוזר לפרט מסודר ובעל יכולת הבעה מאוד גבוהה אכפתי ואוהב 
12810499,2364,5585,סטיב גובס   הוא היה בן אדם מאוד שאפתן  יצירתי  בעל יוזמה  הישגי  פרודקטיבי  בעל גישת חיים טובה וגישה ניהולית שאני מאוד מעריך והיה מספיק אופטימי וחיבוי כדי להלחם ולהצליח גם אחרי שהוא נפל  אחרי שפיטרו אותו מאפל הקים חברה נוספת ובסופו של דבר גם חזר לאפל  
12810739,2365,5589,מרטין לותר קינג  היה אדם אמיץ שלא פחד להביע את עמדתו בפומבי  לבצע צעדים מהותיים בשם האידיולוגיה שלו ולפעול לפיה בכל מחיר  בחרתי את מרטין לותר קינג כי הוא היה אדם שעשה הכל כדי לתקן עוול שעשו לו ולחבריו 
12810906,2366,5590,אני מאוד התחברתי להרמיוני  מסדרת הספרים הארי פוטר  מפני שהיא מאוד אמיצה  ונלחמת על מה שחשוב לה  היא חכמה ופקחית  ועושה בחירות שקולות  היא גם נאמנה לחברים שלה ולמקום שממנו היא באה 
12810976,2367,5591,הרמיוני מסדרת הספרים הארי פוטר  היא מאוד חכמה  מאוד נאמנה לחברים שלה  מסוגלת לראות גם את אלו שהחברה לעיתים מזניחה  מקשיבה לחוקים  אך לא פוחדת לנסות לשנות אותם כאשר הם לא צודקים  אהבתי את ההתמודדות שלי עם ההצקות שהיא חוותה בקשר  לזהותה 
12811458,2368,5592,דוד המלך  דוד היה בן אדם עניו  ובכמה וכמה סיפורים ששמעתי עליו הכרתי את הענווה שלו   בנוסף יש את הספר תהילים ששם הוא מזכיר בכל פסוק כמה כמהיה יש לו לכל יצור ובריאה 
12811853,2369,5593,משה רבנו  מנהיג שידע להנהיג את עמי החל מהתקופות הקשות שלו ועד לכניסה לארץ והתמודד בדרך עם המון קשיים של עם קשה עורף ומלחמות  אני חושב שהוא דמות מאוד חיובית בגלל תכונות המנהיגות והיכולת להבין את השטח ולפעול בהתאם 
12812897,2370,5596,משה רבינו  קם אדם שבקשוי לדבר הוא יכול  בא לפני מלך ענק ואומר לו אתה טועה ותשחרר את העם למרות שהם עבדיו של המלך ואין לו כל אינטרס לעשות זאת  עם כל המכשולים ולפני הים הוא לא פחד ודבק באמונה שלו  גם שבני ישראל יתלוננו ורצו לחזור למצתריים הוא ידע איך לאפ
12813011,2371,5598,מנחם בגין דרש את אחדות העם
12813105,2372,5599,אני אתאר את סבתא שלי  שהלכה באמונה שלמה אחרי סבא שלי בעבודתו למען המדינה ברחבי העולם[ ואי אף הייתה בעבודה זו בעל כורחה  שהאמינה בצדקת הדרך ובאהבת המדינה ולמרות כל הקשיים גידלה 3 ילדים למופת שלימדה אותם לחשוב  להיות ביקורתיים ולהצליח  שגידלה את ילדיה לל
12813105,2373,5599,אני אתאר את סבתא שלי  שהלכה באמונה שלמה אחרי סבא שלי בעבודתו למען המדינה ברחבי העולם[ ואי אף הייתה בעבודה זו בעל כורחה  שהאמינה בצדקת הדרך ובאהבת המדינה ולמרות כל הקשיים גידלה 3 ילדים למופת שלימדה אותם לחשוב  להיות ביקורתיים ולהצליח  שגידלה את ילדיה לל
12813495,2374,5602,סטיבן גרארד שחקן כדורגל קפטן בקבוצת ליברפול המשרה אופי מנהיגותי חד וברור על המגרש ומחוץ לו 
12813620,2375,5603,למני כמה ימים העברתי שיעור על התנועה הציונית ועל בנימין זאב הרצל  ושלמדתי עליו כתבו שהוא בעל תכונות הנראות לי חיוביות כמו בעל כריזימיה   סחף אחריו עשרות אלפי יהודים בפעם הראשונה בתקופה שלו לטובת הקונגרס הציוני הראשון  היה מנהיג דומיננטי  מדבר מגובה העיניי
12814291,2376,5608,שחקן כדורסל בשם קובי בראינט  הוא שחקן שסוחף אחריו קבוצה שלמה שמאמינה בו ונותנת לו הרגשה של בית  הוא מנצח להם משחקים ועוזר להם להתקדם בליגה ולא לוקח על זה קרדיט  הוא לא משתחצן אומר אני הכי טוב הוא צנוע ומחושב  הוא עושה עבודה טובה ולא מצפה לפרס 
12814305,2377,5610,מנחם בגין היה מנהיג אדיר שהשפיע רבות על עם ומדינת ישראל ולמרות זאת נשאר צנוע ומחובר לעם  אני מעריך אותו גם בשל היותו מנהיג גדול וגם משום שלמרות היותו אדם חשוב  הוא לא איבד את ערכיו ואת הצניעות שהיתה לו 
12816663,2378,5614,סבא שלי הוא הדמות בעלת האופי החיובי  סבא שלי שרד את מילחמת העולם השנייה ועלה לארץ במטרה לבנות את הארץ ולפתח אותה  במהלך חייו הוא עשה דברים גדולים ועזר למדינה להתפתח בהמון תחומים  לדוגמה סבי היה יושב ראש האגודה למילחמה בסרטן  הוא היה מיתנדב במשך שנים במדא
12816860,2379,5618,יצחק רבין  אף על פי שיצחק רבין נרצח כשהייתי רק בת שנה וחודשיים הוא מהווה דמות חיובית עבורי  הוא נחשב כאיש הראשון שהיה הכי קרוב להבאת השלום לארצנו  איש בעל דעות שאני תומכת בהן  שהיה מוכן לוותר על דברים מסויימים למען תהליך השלום  הוא היה איש של אהבה  כבוד 
12817768,2380,5620,סבתא שלי  אני חושב שהיא אישה מאוד מיוחדת בעלת חוכמת חיים    חזקה   מתאפיינת בצניעות ואמתית  היא אדם שאפשר ללמוד ממנו המון   תמיד צודקת   יודעת לראות את הטוב שבדבר   ומאוד חזקה בהכרת הטוב ובהבנה שלא הכול מובן מאליו 
12818727,2381,5622,בחרתי בעמנואל מורנו זל דמות צבאית וגיבור במדינה אשר היה חייל בסיירת מטכל והתקדם עם תפקידיו   מה שאופייני לו זה מה שאנשים אמרו עליו לאחר פטירתו    בן אדם אנושי מאוד   אכפתי  נחוש  כריזמטי  אוהב את המדינה   צנוע  נותן כבוד לנמצא מולו   מדבר בגובה העיניים 
13676718,2382,5629,הדמות שאני בוחר בה היא דוד המלך  דוד הושפל עי משפחתו אך כל זה לא הפריע לו להגיע למלוכה  כמו כן הוא נרדף עי שאול אך אעפ כן לא פגע בו כשהייתה לו ההזדמנות  בחרתי בו משום שלא פגע בשאול למרות שיכול היה לעשות זאת  גם משום שהייתה מאוד חשובה לו אחדות העם וכ
13690755,2383,5631,באטמן אדם עשיר ומשאבים שיכול לעשות כל העולה ברוחו ובוחר לעזור לזולת מבלי כוונה אינטרסנטית
13701705,2384,5638,סבא שלי בן אדם גדול בעל לב רחב שאוהב לעזור חכם אבא שלי בן אדם חכם שכל החיים לימד אותי כל מה שאני יודע היום  אלקסנדר זין הבנה שיש בעיה במדינה וישר נרתם לעזור
13701705,2385,5638,סבא שלי בן אדם גדול בעל לב רחב שאוהב לעזור חכם אבא שלי בן אדם חכם שכל החיים לימד אותי כל מה שאני יודע היום  אלקסנדר זין הבנה שיש בעיה במדינה וישר נרתם לעזור
13703255,2386,5641,אני אבחר ביוני נתניהו  הדבר הראשון שבלט אצלו זה עשייה ובאמונה בצדקת הדרך  זה דברים בתור בנאדם במדינה שלנו  חייבים להוביל אותך אם אתה רוצה לתת  הלמה שלו היה חזק והוא המשיך עם זה הלאה  למרות שהוא יכל להתקדם במקומות אחרים והוא התקבל להרבה אוניברסיטאות הוא
13705217,2387,5643,הרצל  חוזה המדינה  אדם שהיה בעל חזון ולמרות כל הקשיים שבאמת היו נראים כבלתי אפשריים  עמד על שלו ונלחם על החזון שלו בלי לוותר ובסוף הצליח למרות כל הקושי 
13706021,2388,5645,ראש הממשלה ביבי נתניהו  בעל שיקול דעת יוצא מן הכלל  חכם מאד  מצליח לתמרן בין אינסוף גורמים שונים 
